{
  "id": "knowledge-object-access-standard-synthetic",
  "object_type": "knowledge_object",
  "title": "Synthetic Access Standard",
  "description": "A generic knowledge object used to show the shared portable record envelope.",
  "status": "active",
  "version": "v1.0",
  "effective_date": "2026-01-01",
  "expiration_date": null,
  "supersedes": [],
  "authoritative_source": "Synthetic Governance Office",
  "source_uri": "../../mappings/okf/bundle/sources/access-standard-source.md",
  "owner": "owner-governance-office-synthetic",
  "steward": "steward-knowledge-management-synthetic",
  "jurisdiction": [
    "jurisdiction-global-synthetic"
  ],
  "applicability": [
    "capability-identity-governance-synthetic"
  ],
  "classification": "public_example",
  "access_policy": {
    "policy_id": "access-policy-public-example-synthetic",
    "allowed_uses": [
      "read",
      "validate",
      "transform",
      "publish_example"
    ],
    "denied_uses": [
      "production_decisioning"
    ],
    "handling_notes": "Synthetic example content only."
  },
  "provenance": {
    "created_by": "author-public-reference-synthetic",
    "created_date": "2026-01-01",
    "method": "synthetic_authoring",
    "change_summary": "Initial synthetic example record."
  },
  "last_reviewed_date": "2026-06-30",
  "related_objects": [
    {
      "id": "policy-access-review-synthetic",
      "relationship_type": "references"
    }
  ],
  "assertions": [
    {
      "assertion_id": "assertion-access-standard-reviewed-synthetic",
      "predicate": "review cadence",
      "object": "annual",
      "confidence": "declared"
    }
  ],
  "evidence": [
    {
      "evidence_id": "evidence-access-standard-summary-synthetic",
      "summary": "Synthetic summary showing why the record is authoritative for the example.",
      "uri": "../../mappings/okf/bundle/sources/access-standard-source.md#summary"
    }
  ]
}
